	HomeTeam	AwayTeam	HomeGoals	AwayGoals	Date	Season	Commentary	Result	sentiment
641	Chelsea	West Ham United	2	2	19/03/2016	16	Slaven Bilic has warned his players not to take Chelsea lightly, even though the champions seemingly have nothing to play for after going out of the Champions League and the FA Cup. Chelsea are nine points behind West Ham United, who are two points off the top four, and have a selection headache with Diego Costa suspended. Nonetheless, Bilic is wary of their threat and West Ham will need to be at their best to win at Stamford Bridge for the first time since 2002. Jacob Steinberg	0	-0.05488809943199158,0.6367111802101135
642	Crystal Palace	Leicester City	0	1	19/03/2016	16	Selhurst Park has been a graveyard for prospective Premier League champions in the past and despite Palace’s failure to record a league win so far in 2016, Leicester City will be wary of their trip to south London. Alan Pardew’s side have belied their struggles to reach the FA Cup semi-finals for the first time in 21 years and, with Yannick Bolasie back on form, Palace could be a potential banana skin for the Foxes. Claudio Ranieri had a sausage, of all things, named after him this week by a local butcher but the Leicester manager knows this is no time to take anything for granted. Ed Aarons	-1	0.004976987838745117,-0.9983035326004028
643	Everton	Arsenal	0	2	19/03/2016	16	It might be cynical to suggest Arsenal have commenced their annual reverse into fourth place but, despite Roberto Martínez’s claims that his opponents remain strong title contenders, a run of one win in eight games in all competitions has presented an all too familiar problem for Arsène Wenger. At least they will not be facing Messi, Suárez, Neymar and co when they arrive at Everton, who have won only one of the past 17 league meetings between the sides and lost seven times already at home in the Premier League this season. Andy Hunter	-1	-0.9075723886489868,-0.997018575668335
644	Swansea City	Aston Villa	1	0	19/03/2016	16	It is easy to see why Francesco Guidolin has described this fixture as the “most important game of the season” for Swansea City. Another three points will take the Welsh club to 36 and surely put any lingering relegation fears to bed. André Ayew is sidelined with an ankle injury but Gylfi Sigurdsson is in fine form and Swansea will be confident of picking up a third win in four matches. As for Aston Villa, they have lost their last five and need a minor miracle. Stuart James	1	0.9957326054573059,-0.9912619590759277
645	Watford	Stoke City	1	2	19/03/2016	16	Watford capped a great season back in the top flight last weekend, as they secured their passage into the FA Cup semi-finals against Arsenal. Quique Sánchez Flores’s side will now look to turn around their league form having only won one of their last six. Stoke City travel to Vicarage Road having lost for the first time in five games last week against Southampton and Mark Hughes will know returning to winnings ways will be tough against Watford’s staunch defence. Simon Hahn	-1	0.27489684025446576,-0.9775915145874023
646	West Brom	Norwich City	0	1	19/03/2016	16	West Brom are one of the form teams in the Premier League having picked up 10 points from their past four games including a 1-0 win over Manchester United two weeks ago. The run has moved them away from danger at the bottom, whereas Norwich City are still deep in trouble. Despite an improved showing against Manchester City last week, Alex Neil’s side have not won since 2 January and are still among the relegation favourites. Simon Hahn	-1	0.9989466071128845,0.022733867168426514
647	Manchester City	Manchester United	0	1	20/03/2016	16	Manchester City can all but kill off Manchester United’s Champions League qualification hopes by winning the 171st derby. This would also boost their bid to ensure a top-four finish and overhaul the faltering Arsenal, who are third. After United’s exit from the Europa League at Liverpool’s hands, Louis van Gaal could do without a defeat and as this is the story of his season, expect little to change regarding his employment. Jamie Jackson	-1	0.9830201268196106,-0.9849464893341064
648	Newcastle United	Sunderland	1	1	20/03/2016	16	Possibly the most important north-east derby to date features two managers with a history of conflict effectively on missions to relegate each other. If the Big Sam-Rafa technical subplot promises edginess, Rafael Benítez is more concerned with marking his first home game in charge of Newcastle by ending Sunderland’s run of six straight derby wins. By peculiar coincidence, four of those victories saw Sunderland under the charge of a new manager presiding over his second game after losing the first. Can Benítez emulate Paolo Di Canio, Gus Poyet, Dick Advocaat and Allardyce? Louise Taylor	0	0.9929592609405518,0.998706042766571
649	Southampton	Liverpool	3	2	20/03/2016	16	A repeat of the 6-1 victory that Liverpool enjoyed at St Mary’s in the Capital One Cup in December would be welcome for Jürgen Klopp’s team, who remain within striking distance of the top four. But Southampton have tightened up since then and, with Graziano Pellè back on the goal trail and Sadio Mané having had his red card rescinded, they have the firepower to pursue their own European ambitions. All is set for a high-stakes, high-quality duel. Paul Doyle	1	0.9996364116668701,0.9995529055595398
650	Tottenham Hotspur	Bournemouth	3	0	20/03/2016	16	Tottenham Hotspur can now focus solely on their pursuit of a first league title in 55 years with their involvement in Europe curtailed in midweek, though Bournemouth will hardly be pushovers at White Hart Lane. Eddie Howe’s side are mid-table, virtually safe, unbeaten away from home in 2016 and have won their last three matches. The hosts will restore Harry Kane, Christian Eriksen, Mousa Dembélé and their full-back pairing and hope they hit the ground running. Last Sunday’s win at Villa Park has eased a few nerves, but now is the time for Mauricio Pochettino’s side to generate real momentum. Dominic Fifield	1	0.8875520428021749,0.9879824221134186
651	Arsenal	Watford	4	0	02/04/2016	16	Watford are enjoying a great season under Quique Sánchez Flores, but with one point from their last four league games they still have to be careful. Arsenal need victory to stay in the top four – and to keep any possible title hopes alive. These sides met at the Emirates only three weeks ago in the FA Cup, when Watford worked incredibly hard to knock out an Arsenal side that looked far too complacent on the day. Arthur Renard	1	-0.09294769167900085,-0.9327961802482605
652	Aston Villa	Chelsea	0	4	02/04/2016	16	Does anyone still believe Aston Villa are capable of producing a miracle? No. They are 12 points adrift of safety with seven games to go but have long looked resigned to relegation. It makes this early kick-off something of a nothing game. Chelsea have a nine-point gap to sixth, perhaps making it an ideal time for Guus Hiddink to give a portion of the club’s youngsters some minutes. Alan Smith	-1	-0.985680878162384,0.9887663722038269
653	Bournemouth	Manchester City	0	4	02/04/2016	16	Manuel Pellegrini’s Manchester City travel to the south coast in search of their first win in four matches. After losing to Manchester United before the international break, City’s hopes of securing a top-four finish suddenly look precarious, with in-form West Ham United breathing down their necks. Bournemouth travelled to Dubai for a five-day training camp over the international break and Eddie Howe is keen for the home side to perform after a 5-1 defeat at the Etihad in October. “It’s not one we just want to host and put on a show for them, we want to give them a really good game,” said Howe. Ben Fisher	-1	0.9947963356971741,-0.06490805745124817
654	Liverpool	Tottenham Hotspur	1	1	02/04/2016	16	Liverpool have not cast off their maddening inconsistency, as confirmed inside 90 minutes at Southampton, but a trip to Anfield represents a fundamental test of Tottenham’s title credentials regardless. The visitors have won only one of their last 21 league trips to Liverpool and have collected nine points from the last 63 available at Anfield. But with Harry Kane one goal short of a Premier League record for Spurs and Dele Alli confronting the club that neglected to sign him, Mauricio Pochettino has the talent to make a significant statement of intent. Andy Hunter	0	0.020071953535079956,0.9982309937477112
655	Norwich City	Newcastle United	3	2	02/04/2016	16	Defeat would leave both of these sides even deeper in relegation trouble so the first test at Carrow Road will be to conquer nerves. That will be particularly true for the goalkeeper – probably Karl Darlow – drafted into the Newcastle line-up to replace the injured Rob Elliot. None of Norwich’s strikers have scored regularly this season but whichever of them is deployed by Alex Neil is sure to be instructed to put as much pressure as possible on the inexperienced stand-in. Paul Doyle	1	-0.08383649587631226,0.9986534118652344
656	Stoke City	Swansea City	2	2	02/04/2016	16	Stoke City and Swansea City have been playing well of late and both need another victory, for different reasons. The Swans need the points to get safe from relegation while Stoke are still hoping for Europa League qualification. In their last four meetings at the Britannia Stadium, Stoke have won three. Despite losing Jack Butland for the season, Mark Hughes will be hoping Marko Arnautovic, a scorer in their past three home games, can be the difference again. Arthur Renard	0	0.3512030045191447,-0.9189061522483826
657	Sunderland	West Brom	0	0	02/04/2016	16	A run of 17 games without a clean sheet has undermined the improvements implemented by Sam Allardyce at Sunderland. “It means we need to score twice to stand a chance of winning,” said Allardyce who will aim to put such defensive shortcomings right at the expense of his friend Tony Pulis in what threatens to prove a less than expansive contest. While West Brom enjoy the luxury of mid-table security, anything less than victory will escalate Wearside relegation concerns. Louise Taylor	0	-0.9993457198143005,-0.9976547956466675
658	West Ham United	Crystal Palace	2	2	02/04/2016	16	Alan Pardew returns to a former club in desperate need of points. Crystal Palace were fifth on New Year’s Eve but 13 games without a league win have transformed them into unlikely relegation candidates. Yet although they have won each of their past two visits to Upton Park, Palace are sure to find it tough against Slaven Bilic’s West Ham United, who have their eyes on the Champions League. Jacob Steinberg	0	0,0.18144599596659342
659	Leicester City	Southampton	1	0	03/04/2016	16	Leicester City will hope a fourth successive win on Sunday will serve to extend their advantage at the top of the table from its current five points. Certainly, even a home game against a fine Southampton side will feel like an opportunity and, for once, the hosts must perform after Tottenham Hotspur’s daunting trip to Anfield. The likes of Jamie Vardy, Danny Drinkwater and N’Golo Kanté will have returned to the King Power Stadium buoyed by their impact over the international break. A repeat of Riyad Mahrez’s brace last May would do the home side very well indeed. Dominic Fifield	1	0.997871478398641,0.9869482815265656
660	Manchester United	Everton	1	0	03/04/2016	16	After the exhilaration of the 1-0 derby win at Manchester City, Manchester United have eight league matches to move up from sixth to fourth place and thus qualify for the Champions League. Everton were downed 3-0 at Goodison Park in October’s reverse fixture and Louis van Gaal said it was a complete display. How Van Gaal would love a repeat over a Roberto Martínez side whose 38 points is a poor yield given their array of stellar talents, led by Romelu Lukaku and Ross Barkley. Jamie Jackson	1	0.015177875757217407,0.9979363679885864
661	Aston Villa	Bournemouth	1	2	09/04/2016	16	It may seem incredible but Aston Villa are bidding to complete a league double over Bournemouth, after securing their only away win against Eddie Howe’s side on the opening day of the season. Since then Villa have crumbled, sacking Tim Sherwood and Rémi Garde. All hopes of avoiding relegation are more mathematical than plausible now and the drop could be confirmed on Saturday. Graham Searles	-1	-0.0006427168846130371,0
662	Crystal Palace	Norwich City	1	0	09/04/2016	16	For most clubs tantalisingly in touch of safety, successive home games against Norwich City and Everton would represent an opportunity. After all, Alex Neil’s side are one of the few teams below Crystal Palace, while Everton’s focus is purely on an FA Cup semi-final to come. Yet Alan Pardew’s side have lost their last six matches at Selhurst Park and Norwich are in their best form of the season and threatening to break free of the condemned. Pardew has called for a raucous atmosphere but this pocket of south London may be gripped by nerves. Dominic Fifield	1	-0.3837115367253621,0.9989608526229858
663	Manchester City	West Brom	2	1	09/04/2016	16	As they welcome West Brom, Manuel Pellegrini’s side should be buzzing after the 2-2 draw at PSG in Wednesday’s Champions League quarter-final first leg. This bounce may be required to dismantle a Tony Pulis side that could feature a four-man defence of centre-backs, as is the manager’s penchant. This was what Manchester United faced when they lost at The Hawthorns last month and, as Louis van Gaal’s side are at Tottenham Hotspur on Sunday, here is a chance to open up a four-point lead over United in the race for a Champions League berth. Jamie Jackson	1	0,0.3595788876215617
664	Southampton	Newcastle United	3	1	09/04/2016	16	The Rafa Benítez effect has yet to take hold at Newcastle and the manager and club are running out of time and matches. If they are to make a late dash out of the relegation zone, they could do with getting their first away point – or three – of the year at St Mary’s. Aleksandar Mitrovic made a strong case for a starting spot, scoring twice at Norwich last week after coming off the bench, but Southampton’s central defenders are capable of stifling the Serb’s aerial ability and the hosts will fancy their chances of winning to reassert their push for European qualification. Paul Doyle	1	-0.13292381167411804,-0.999167799949646
665	Swansea City	Chelsea	1	0	09/04/2016	16	Chelsea have never drawn blank against Swansea in the Premier League and combined with the fact that Guus Hiddink is yet to lose a league game since returning, the omens are not brilliant for Francesco Guidolin. However, Gylfi Sigurdsson’s three goals in his last four games have lifted Swansea from imminent danger and the Icelander’s semblance of his former brilliance could upset the odds. Graham Searles	1	0.996910035610199,-0.9985321760177612
666	Watford	Everton	1	1	09/04/2016	16	Roberto Martínez will be perturbed by Everton’s run of three successive league defeats. However, the Spaniard will see Watford, who are on an even worse run of four defeats, as a golden opportunity to gain momentum ahead of their season-defining FA Cup semi-final. Quique Sánchez Flores will feel exactly the same as Watford have a semi-final of their own to contend against Crystal Palace. Graham Searles	0	0.8971894780794779,-0.6936708688735962
667	West Ham United	Arsenal	3	3	09/04/2016	16	West Ham began their season with a 2-0 victory at the Emirates Stadium and their chances of finishing in the top four could rest on completing their first league double over Arsenal since the 2006-07 season. Yet Arsenal are in good form, thrashing Everton and Watford in their previous two matches, and victory at Upton Park would keep their title hopes alive. Jacob Steinberg	0	0.9893611073493958,0.9997912049293518
668	Liverpool	Stoke City	4	1	10/04/2016	16	Jürgen Klopp’s team are eyeing European qualification through the glorified route of winning the Europa League but both sides will be looking to enhance their claims via the Premier League at Anfield. Liverpool and Stoke City have met three times this season with the away team winning 1-0 on each occasion, although disappointingly for Mark Hughes that was not enough to take his side into the Capital One Cup final on their last visit to Anfield. Liverpool’s options are stretched in central midfield with Jordan Henderson injured and Emre Can commencing a two-match suspension. Andy Hunter	1	-0.011082351207733154,0
669	Sunderland	Leicester City	0	2	10/04/2016	16	Jan Kirchhoff and Yann M’Vila take on N’Golo Kanté and Danny Drinkwater in an intriguing meeting between two formidably strong central midfield departments as two teams with broadly similar playing philosophies lock horns. Jermain Defoe will hope to upstage Jamie Vardy on a day when Sunderland aim to prove they are not quite as bad as their position, third bottom in the table, suggests. Sam Allardyce’s problem is that Leicester will want to remind everyone – Tottenham particularly – why they would make worthy champions. Louise Taylor	-1	-0.8481724858283997,0.0031071901321411133
670	Tottenham Hotspur	Manchester United	3	0	10/04/2016	16	If the title is not going to end up with Claudio Ranieri and Leicester, Tottenham need to win here. Kyle Walker’s own goal gave United three points and a flying start to the season in August, but since then Tottenham have improved in all areas. United haven’t lost at White Hart Lane in any of their last 14 league encounters, and have two successive clean sheets behind them. Joel Tivemo	1	0.0690746009349823,0.999367892742157
671	Chelsea	Manchester City	0	3	16/04/2016	16	Eyebrows would have been raised if you said these two would be long ruled out of title contention by mid-April before this most unpredictable of seasons began, but this will at least be a tad more competitive than City’s last visit to Stamford Bridge, where Manuel Pellegrini’s protest team were skewered 5-1 in the FA Cup. They could do with a win to help their top-four case. Alan Smith	-1	0,0.9692015647888184
672	Everton	Southampton	1	1	16/04/2016	16	Europe remains an incentive for Ronald Koeman with his team just two points off qualification for the Europa League but for Roberto Martínez the pressure is much closer to home. Eight home league defeats are the principal reason for mounting criticism of the Everton manager, who has a Merseyside derby and FA Cup semi-final next week and may protect such leading players as Romelu Lukaku and Ross Barkley from minor knocks as a consequence. Andy Hunter	0	-0.8206437528133392,0
673	Manchester United	Aston Villa	1	0	16/04/2016	16	Wayne Rooney will expect to be named in the Manchester United starting XI for the first time since injuring a knee on 13 February in the 2-1 defeat at Sunderland. If he does not, expect a prolonged inquest into why. Especially as Aston Villa could be relegated at the final whistle, so are ideal opponents for the captain to ease his way back into the fray from the start. Jamie Jackson	1	0.9861690998077393,0.9955845475196838
674	Newcastle United	Swansea City	3	0	16/04/2016	16	Rafael Benítez celebrates his 56th birthday on Saturday but he will only be smiling if he secures his first win as manager of Newcastle United. Should Benitez’s players suffer another stumble survival will, realistically, be near impossible so the Spaniard could do with a strong performance from Jonjo Shelvey against his former employers. He must also cope without Daryl Janmaat, his Holland right back, who has undergone hand surgery after punching a dressing room wall in frustration during last Saturday’s defeat at frustration. Tynesiders can only pray Swansea’s Gylfi Sigurdsson’s recent stellar form deserts him. Louise Taylor	1	0.9662497937679291,-0.998753547668457
675	Norwich City	Sunderland	0	3	16/04/2016	16	This is the type of game the phrase six-pointer was created for but the Friendship Trophy is more important for Sunderland, who would pull within a point of Norwich with victory. A win for Alex Neil’s team will give them at least a six-point cushion from the relegation zone – possibly more depending on events at St James’ Park – with four games to go. Newcastle, for once, will be hoping their local rivals win. Alan Smith	-1	0.9966806769371033,0.9896093904972076
676	West Brom	Watford	0	1	16/04/2016	16	What odds this battle of 14th versus 15th and joint-lowest scorers in the division being last on Match of the Day? Albion have the worst shots-on-target average in the country, while Watford are on a stinking run of form (losing four of their last five) and might have an eye on next weekend’s FA Cup semi-final. The reverse fixture, predictably, ended scoreless. Alan Smith	-1	-0.9996578693389893,0
677	Arsenal	Crystal Palace	1	1	17/04/2016	16	Arsenal have reached the point where they need a near-miracle for a title win and it feels like the imperative now is to button down a Champions League finish and, ideally, reel in Tottenham Hotspur. Their run-in looks favourable and they do have a cushion over fifth-placed Manchester United. Arsène Wenger merely wants victories over teams that Arsenal should be beating, and prayers to be answered. Crystal Palace have an FA Cup semi-final next Sunday. Has this been mentioned at all? David Hytner	0	-0.8086807131767273,0.988584041595459
678	Bournemouth	Liverpool	1	2	17/04/2016	16	How much energy will Liverpool have after Thursday night’s heroic comeback against Borussia Dortmund? A trip to face Eddie Howe’s high-energy Bournemouth, who could remarkably finish in the top half in their debut top-flight season, is sure to be testing. The hosts will be without influential midfielder Harry Arter, though, who has an ankle injury that might rule him out of Euro 2016. Alan Smith	-1	0.0001590251922607422,0.9908711314201355
679	Leicester City	West Ham United	2	2	17/04/2016	16	Five games to go. Leicester can afford to slip up in two of them and still win their first title but on current form it looks like they might secure the trophy with time to spare. Victory against West Ham, likely still hurting from their FA Cup exit to Manchester United in midweek, would see Claudio Ranieri’s team 10 points clear of Tottenham before the Londoners play Stoke on Monday. This fixture last season was the moment Leicester started their recovery, winning 2-1. Alan Smith	0	0.9963063895702362,0.9878376722335815
680	Stoke City	Tottenham Hotspur	0	4	18/04/2016	16	By kick-off at the Britannia on Monday evening, Tottenham could be 10 points behind Leicester with five games to play. They should, however, have enough to beat Stoke, who remain saddled with selection problems in defence and have won only once in their last five outings. Jakob Haugaard has been unconvincing in goal so Stoke’s Irish veteran Shay Given could be brought in. Alan Smith	-1	-0.77457195520401,0.9703866243362427
681	Aston Villa	Southampton	2	4	23/04/2016	16	The departures of David Bernstein and Mervyn King from the board and the suspensions of Gabriel Agbonlahor and Jores Okore made it another dire week for Aston Villa in an already dreadful season. Things are unlikely to improve on Saturday with Southampton needing a win to keep their European hopes alive. Already relegated after nine defeats in a row, the only thing the Villa squad have left to play for is pride – but will they show any? Rich Flower	-1	-0.9117623567581177,-0.984557032585144
682	Bournemouth	Chelsea	1	4	23/04/2016	16	Bournemouth’s victory over Chelsea in December was the penultimate league match of José Mourinho’s second tenure at Stamford Bridge and, when Glenn Murray struck late on, it ensured the champions remained mired in the bottom reaches of the table. Now Chelsea are three points clear of Eddie Howe’s side as the campaign draws to a close, but it is clear which club has enjoyed the better season. James Riach	-1	0.959726870059967,0.999196469783783
683	Liverpool	Newcastle United	2	2	23/04/2016	16	Rafael Benítez’s return to Anfield as the interim manager of Chelsea in 2013 was overshadowed somewhat by Luis Suárez’s bite on Branislav Ivanovic. He heads back seeking a favour from his old club in his attempt to keep Newcastle in the Premier League, but Liverpool are not in the form to give one – regardless of what team Jürgen Klopp selects. With Villarreal in the Europa League semi-finals to come next week, Klopp may revert to the much-changed lineup that beat Bournemouth last Sunday. Andy Hunter	0	-0.1758049726486206,-0.9971274733543396
684	Manchester City	Stoke City	4	0	23/04/2016	16	As is the tale of their season, Manchester City were flying on arrival at Newcastle United on Wednesday night but stumbled surprisingly and could only draw against the relegation-threatened side. Now Stoke City must be beaten or Manchester United could overhaul Manuel Pellegrini’s side in the chase for a Champions League place. The visitors will need no reminding of how they dismantled City 2-0 in early December so this will be an intriguing watch. Jamie Jackson	1	0.014453232288360596,-0.957821249961853
685	Leicester City	Swansea City	4	0	24/04/2016	16	While few could deny that the suspension of Jamie Vardy is a significant blow to Leicester’s title aspirations, Claudio Ranieri’s side coped when he went five games without scoring in February and March – they won four and drew one. Swansea, who have nothing to play for and have won away only three times all season, should be pushovers for the hosts but the pressure of leading the pack can have a funny effect – just ask Kevin Keegan. Rich Flower	1	0.9786962270736694,0.9923422932624817
