	HomeTeam	AwayTeam	HomeGoals	AwayGoals	Date	Season	Commentary	Result	sentiment
324	Swansea City	Hull City	3	1	04/04/2015	15	A home match against Hull offers Swansea a good chance to pick up their first points following an international break this season. Away games at Chelsea, Stoke and Manchester City all ended in defeat and the Swansea manager, Garry Monk, says his side “have to put that right” on Saturday. The visitors will be encouraged by the return of James Chester and Mohamed Diamé from injury. Rich Flower	1	0.003595024347305298,0.9998767375946045
325	West Brom	Queens Park Rangers	1	4	04/04/2015	15	Tony Pulis was typically assertive when he said on Friday that West Brom had “gone off the rails” in recent seasons and he is looking to rebuild the club from top to bottom. He has certainly improved West Brom but they could struggle if Saido Berahino and Brown Ideye fail late fitness tests. That said, QPR’s away form has been dreadful this season, so Pulis will surely remain confident. Graham Searles	-1	-0.9787609875202179,0.5498413443565369
326	Burnley	Tottenham Hotspur	0	0	05/04/2015	15	Burnley begin the day in the relegation zone but just one point from safety. Sean Dyche is unrelenting in his view that they can stay in the Premier League and his players will need to draw on every last drop of his defiance to keep Harry Kane from adding to his impressive goal tally. Tottenham are reliant on Kane and will need him to keep firing to maintain their Champions League ambitions. Graham Searles	0	-0.8998302519321442,-0.9915502071380615
327	Sunderland	Newcastle United	1	0	05/04/2015	15	The so called “Desperation Derby” sees Sunderland hoping to assuage their relegation worries and Newcastle United aiming to end a run of four successive defeats against their detested neighbours. As Dick Advocaat takes charge of Sunderland for the second time much looks set to hinge on the likely midfield duel involving the home enforcer Lee Cattermole and Moussa Sissoko. By uncanny coincidence, Advocaat’s two immediate predecessors, Gus Poyet and Paolo Di Canio, also faced Newcastle during their second matches at the helm, both securing slightly unexpected victories. Louise Taylor	1	0.0021861791610717773,0.9996919631958008
328	Crystal Palace	Manchester City	2	1	06/04/2015	15	The champions will be braced to start Monday’s game in south London nine points behind the leaders, Chelsea, and possibly even from a relatively lowly fourth place in the table, making victory at Selhurst Park essential. Their recent record at Crystal Palace is excellent, the hosts having failed to prevail in this fixture since December 2001, though Alan Pardew’s team have been resurgent of late.The visitors will enjoy the possession, but must be guarded for the pace on the counter offered by Jason Puncheon, Wilfried Zaha and Yannick Bolasie. Dominic Fifield	1	0.8933789531389872,0
329	Burnley	Arsenal	0	1	11/04/2015	15	A win for Arsenal would take them to within touching distance of the leaders, Chelsea, if only momentarily, before José Mourinho’s side play QPR on Sunday. The visitors are in search of their eighth successive victory in all competitions, while Burnley have just one win from their past 10 games. Arsenal have not lost to a team in the bottom half this season but Sean Dyche’s side have already beaten one of the top four at Turf Moor, defeating the champions, Manchester City, 1-0 last month. Ben Fisher	-1	0.006396442651748657,0.9968481659889221
330	Southampton	Hull City	2	0	11/04/2015	15	Southampton’s challenge for a Champions League spot may have faded but Hull are unlikely to find them in an accommodating mood. A fifth-place finish is still very much within the home side’s grasp and that would represent a fine achievement for Ronald Koeman in his debut season. A lack of firepower has been the main reason for Southampton’s deteriorating results but their overall performances have remained impressive and they should be too strong for a creaking Hull side in danger of being sucked into the relegation zone. If Steve Bruce’s side are to save themselves, it will probably be during their remaining home fixtures. Paul Doyle	1	0.41629910469055176,-0.9630313515663147
331	Sunderland	Crystal Palace	1	4	11/04/2015	15	Alan Pardew has a particular point to prove at a ground where he can expect plenty of abuse from the stands. As Newcastle United manager he lost his last four north-east derbies against Sunderland and will be anxious to see his Palace side wreak revenge on Dick Advocaat’s relegation-threatened team. Advocaat is likely to be wary of Palace’s counterattacking threat as he aims to build on last Sunday’s home triumph against John Carver’s Newcastle. Even if the current mini-heatwave continues, Sunderland’s Dutch manager is expected to wear his lucky brown winter scarf. Louise Taylor	-1	-0.9294074475765228,0.004341423511505127
332	Swansea City	Everton	1	1	11/04/2015	15	Swansea have never beaten Everton in the league though they saw them off 3-0 in the League Cup and another win would take the Swans past the previous-best points total of 47. For Roberto Martínez it is back to the club where it all started as a manager and after a season’s best three league wins in a row, will be looking to extend that as the race for places and prize money intensifies. Mark Tallentire	0	0.9897006750106812,0.996132493019104
333	Tottenham Hotspur	Aston Villa	0	1	11/04/2015	15	Will it be a triumphant return to White Hart Lane for Tim Sherwood? How he would love to get one over on his former club and show Tottenham Hotspur that they were wrong to sack him last summer, although it is not all about revenge for the Villa manager. His team are a mere three points above the bottom three and are winless in their past three matches. Yet putting an end to that worrying run will not be straightforward against Spurs, who have not completely given up hope of finishing in the top four. Jacob Steinberg	-1	-0.0026943981647491455,0.00026619434356689453
334	West Brom	Leicester City	2	3	11/04/2015	15	West Brom will celebrate Jeff Astle Day hoping to overcome last weekend’s humbling at the hands of QPR, when Tony Pulis’s team shipped four goals to leave them with only one win from their past five games in all competitions. Leicester, buoyed by a win over West Ham a week ago, need to keep building momentum if they are to defy the odds and survive an immediate return to the Championship. They sit six points from safety but have a favourable run-in. Alan Smith	-1	0.9881770014762878,-0.9909512996673584
335	West Ham United	Stoke City	1	1	11/04/2015	15	Although unhelpful, fresh doubts over the long-term future of the West Ham manager, Sam Allardyce, should not derail West Ham’s hopes of securing a top-half finish. The hosts have lost four of their past five matches and go into the game level on points with Stoke, who have lost their previous three. This hardly suggests a classic is in store but keep an eye on Peter Crouch, who is one headed goal away from Alan Shearer’s Premier League record of 46. Ben Fisher	0	-0.9208999276161194,0.993958592414856
336	Manchester United	Manchester City	4	2	12/04/2015	15	Can Manchester United beat Manchester City for the first time on their own patch since 2011? Can Manuel Pellegrini’s champions halt a slide that has featured three defeats in the past five league games? The answers to these questions – and many more – should be known by 6pm on Sunday when whichever team has kept their head best amidst the sound and fury of the 169th derby has the best chance of claiming the spoils. Jamie Jackson	1	-0.9974958300590515,0
337	Queens Park Rangers	Chelsea	0	1	12/04/2015	15	Queens Park Rangers should draw encouragement from four points and seven goals in two games on the road over the last week, though their more attacking approach might open the door for Chelsea to revel in the west London derby. José Mourinho has no qualms about selecting Nemanja Matic or Cesc Fàbregas, both of whom are one booking away from a two-match ban before the weekend cut-off. “We need points, we need victories, we cannot choose matches,” he said. The same applies to the hosts. Dominic Fifield	-1	0.9815278053283691,-0.9952771663665771
338	Liverpool	Newcastle United	2	0	13/04/2015	15	Both managers require a response from their teams at Anfield but for very different reasons. Liverpool restored confidence by reaching the FA Cup semi-finals on Wednesday but, after consecutive defeats in the Premier League, can ill afford another slip if they are to catch any of the teams above them in the race for Champions League qualification. Newcastle should be safe on 35 points but, after the misery of another derby loss and amid growing supporter unrest, John Carver desperately needs to stem the decline. Andy Hunter	1	-0.9746177196502686,-0.9981535077095032
339	Chelsea	Manchester United	1	0	18/04/2015	15	Louis van Gaal’s side will arrive in south-west London in the best form of their campaign but with their defensive ranks severely depleted by injury and suspension. Phil Jones, Michael Carrick, Daley Blind, Marcos Rojo and Jonny Evans will all be absent, but there will be no sympathy from José Mourinho. “Their squad is amazing, in numbers, players, experience, solutions,” said the Portuguese, whose side can move 11 points clear of their visitors with victory. Chelsea, who will give a late check to Loïc Rémy, know a win will bring the title tantalisingly within reach. Dominic Fifield	1	0.9992988109588623,-0.9955168962478638
340	Crystal Palace	West Brom	0	2	18/04/2015	15	This time last year Tony Pulis was being feted for his remarkable rescue act at Selhurst Park, a mantle that has now passed on to Alan Pardew who, with eight wins from 12 games, has banished thoughts of relegation. Pulis initially performed a similar feat at The Hawthorns too, but returns to Palace after successive home defeats to QPR and Leicester that mean Albion are not safe yet. Paul Chronnell	-1	0.9968698620796204,-0.9976891279220581
341	Everton	Burnley	1	0	18/04/2015	15	Everton will hope that the return of Romelu Lukaku will give them impetus to equal their season’s best run, five games unbeaten, as a disappointing campaign draws to a close. Burnley, glad to see the back of eight matches against the league’s top eight, will be fighting hard to pick up three points in their fight to stay up at Goodison, which is not the fortress that it was last season. This is the 100th top-flight meeting between the two sides. Graham Searles	1	-0.8463931083679199,0.0074295103549957275
342	Leicester City	Swansea City	2	0	18/04/2015	15	Suddenly Leicester is awash with optimism. Bottom of the table since November, the Foxes could leap out of the relegation zone with victory over a depleted Swansea side. While Garry Monk has to decide who to turn to for goals in the absence of striker Bafétimbi Gomis, Nigel Pearson has a fully fit squad and players who are infused with confidence following two successive victories. Erratic finishing has been a recurring problem for Leicester this season, but if they are wearing their shooting boots on Saturday, the hosts could claim a precious three points. Paul Doyle	1	0.33333486318588257,0
343	Stoke City	Southampton	2	1	18/04/2015	15	Southampton travel to Stoke hoping to keep their Champions League ambitions alive. The Saints are five points behind fourth-placed Manchester City and will believe that overhauling the champions is still possible. Mark Hughes has said he will use the game to gauge Stoke’s progress and any positive result would show they had made some as Stoke have lost to Southampton twice this season. Graham Searles	1	0.9912576675415039,0.9963509440422058
344	Manchester City	West Ham United	2	0	19/04/2015	15	The fascination with this fixture lies in what may happen to Manuel Pellegrini if Manchester City lose. If the champions were to suffer a seventh defeat in nine outings to continue their slump in 2015 – City were joint-top on New Year’s Day and are now fourth – the manager’s position may become untenable. In this scenario Liverpool, who are in FA Cup semi-final action this weekend, could close to only a point behind if they won their extra match. A victory, though, and Pellegrini’s garden, and that of City’s, becomes far rosier. Jamie Jackson	1	-0.19937461614608765,0
345	Newcastle United	Tottenham Hotspur	1	3	19/04/2015	15	Newcastle have lost five consecutive Premier League games and it looks as if some players have already begun to think of pastures new. John Carver will find it tough motivating his side considering their abject form and Tottenham Hotspur will be looking to capitalise on this. Spurs may also struggle for motivation, though, as it looks as if they will miss out on the Champions League. Graham Searles	-1	-0.998815655708313,-0.9545535147190094
346	Burnley	Leicester City	0	1	25/04/2015	15	Three successive victories have lifted Leicester City off the foot of the table and they will look to continue that run against Burnley, the side who now find themselves propping up the rest of the league. It promises to be a tumultuous affair at Turf Moor. Leicester are in form, while Burnley will fight until the end. However Burnley have problems in attack, with Ashley Barnes suspended and Danny Ings goalless in his past eight matches. Jacob Steinberg	-1	0.28823111454645794,0.9992415904998779
347	Crystal Palace	Hull City	0	2	25/04/2015	15	Hull City travel to Crystal Palace above the relegation zone, but if their current run of poor form continues , and the clubs below them carry on their recent renaissance, the bottom three will beckon at the final whistle. Crystal Palace have performed well under Alan Pardew and he will expect a return to winning ways after a disappointing defeat to West Brom last time out. Graham Searles	-1	0.6977838277816772,-0.6279986500740051
348	Manchester City	Aston Villa	3	2	25/04/2015	15	Manchester City have won six of the last seven league encounters against Aston Villa. It might not be a procession this time, though, with Tim Sherwood’s FA Cup finalists showing strength to turn around their Wembley tie against Liverpool last weekend. Without Belgium team-mate Vincent Kompany in his way, Christian Benteke could extend his scoring run to five games in a row. Graham Searles	1	0.9984464049339294,0.9817672073841095
349	Newcastle United	Swansea City	2	3	25/04/2015	15	After six straight defeats and with relegation fears not quite banished John Carver could do with Newcastle finally winning a game. Supporters plan to stand up en masse in the 34th minute to protest against Mike Ashley’s ownership where cash reserves of £34m sit untouched in the bank while a threadbare squad remains alarmingly under-staffed. Carver has said Newcastle may need to play ugly and there promises to be a contrast between their tactics and Swansea’s possession game. Louise Taylor	-1	-0.298759400844574,0
350	Queens Park Rangers	West Ham United	0	0	25/04/2015	15	If QPR are to accumulate sufficient points to stay up, Chris Ramsey will have marked this game as a must-win. The manager will be plotting trips to Anfield and the Etihad after this as matches they would not be expected to triumph in. West Ham, currently 10th and with one win from 12 in all competitions, are easing to the finish line and look to be there for the taking. Alan Smith	0	0.9974727034568787,0.9991180300712585
351	Southampton	Tottenham Hotspur	2	2	25/04/2015	15	Mauricio Pochettino does not hide the fact that he would rather be spared the toils of the Europa League next season, yet he will surely want Tottenham to win on his return to St Mary’s. Ronald Koeman, by contrast, is eager for his team to qualify for European competition and victory over Spurs would help secure that and also give the club more points than they achieved under the Argentinian last term. Paul Doyle	0	0,0.9535312652587891
352	Stoke City	Sunderland	1	1	25/04/2015	15	Sunderland have a number of players missing for their visit to the Potteries: Steven Fletcher, Seb Larsson, Emanuele Giaccherini, Wes Brown and Ricky Álvarez. Stoke City will have midfielder Stephen Ireland ready but will be missing Marc Muniesa. Sunderland, 16th in the league, find themselves in a precarious position and will need a positive result to stave off relegation fears. George Sandeman	0	-0.9961575865745544,-0.9909286201000214
353	West Brom	Liverpool	0	0	25/04/2015	15	After suffering FA Cup defeat at the hands of Aston Villa last week, Liverpool face another Midlands side. Tony Pulis will have Craig Dawson available but will be without Youssouf Mulumbu and Andre Wisdom. Liverpool will want to put some distance between themselves and Spurs and Southampton in the table while the Baggies will hope to reinforce their Premier League safety. George Sandeman	0	-0.9885339140892029,0.03702664375305176
354	Arsenal	Chelsea	0	0	26/04/2015	15	Arsenal have their opportunity to nibble at Chelsea’s lead, with Arsène Wenger seeking a first victory over a José Mourinho side at the 13th try, and to postpone the visitors’ coronation for another week at least. The focus will be drawn towards Cesc Fàbregas on his first return to the Emirates as a Chelsea player with Mourinho’s sales pitch having lured him from Barcelona last summer. “I promised him he’d be an important player in our project,” said the Portuguese. “And that, normally, good projects end with titles.” The home support will be pained that their former favourite is close to achieving that aim. Dominic Fifield	0	0.9079700112342834,0.9908502697944641
355	Everton	Manchester United	3	0	26/04/2015	15	The Grim Reaper will not be awaiting Manchester United’s manager on this visit to Goodison Park. A year on from David Moyes’ final game at United, against his former club of all teams, Louis van Gaal takes his in-form side to Everton seeking to strengthen claims on automatic Champions League qualification. United need a response to last weekend’s defeat at Chelsea with Manchester City and Liverpool in pursuit but Roberto Martínez’s side have improved of a difficult season with four wins in a five-game unbeaten run. Andy Hunter	1	0,0.3362513581911723
356	Aston Villa	Everton	3	2	02/05/2015	15	With thoughts of the FA Cup final shelved this is one of three home games Tim Sherwood is targeting as Villa, two points above trouble, play for survival. With Christian Benteke in better goalscoring form than his countryman Romelu Lukaku, the manager is wary but optimistic. Everton are unbeaten in six games, last lost to Villa in August 2010 and not yet on the beach. Mark Tallentire	1	0.3406440218289693,0.9975366592407227
357	Leicester City	Newcastle United	3	0	02/05/2015	15	It remains to be seen whether the realisation that Newcastle have fallen into the relegation fight will jolt John Carver’s side into action – if it does not, then chances are that Leicester will drag them further into trouble on Saturday lunchtime by earning the victory that would take them to within a point of Newcastle, who were 17 points clear of Nigel Pearson’s side before this seven-match losing streak. Leicester played well when losing to Chelsea in midweek and will be confident of recording a fifth win in six matches. Paul Doyle	1	0.9997616410255432,-0.6228821873664856
358	Liverpool	Queens Park Rangers	2	1	02/05/2015	15	QPR have only four games to overturn a four-point deficit and preserve their Premier League status with the first of three remaining away matches coming at a ground where they have won once in their history. The statistics do not augur well for Chris Ramsey’s team but they can take hope from the hangover Liverpool have been nursingsince their FA Cup semi-final defeat. Champions League qualification is fading from view for Brendan Rodgers’ men. Steven Gerrard, having been rested for the midweek defeat at Hull City, is available to make his penultimate Anfield appearance. Andy Hunter	1	0.26231388250986737,-0.75776606798172
359	Manchester United	West Brom	0	1	02/05/2015	15	Sunday’s defeat to Everton consigned Louis van Gaal’s Manchester United to consecutive reverses for the first time in his inaugural season but Liverpool losing to Hull City then eased Champions League qualification concerns. The Dutchman put the 3-0 humiliation at Goodison Park down as a one-off. Expect Van Gaal to be a little less sanguine should struggling West Brom turn United over and make it a twice-off. Jamie Jackson	-1	-0.7681655287742615,0.9430628418922424
360	Sunderland	Southampton	2	1	02/05/2015	15	Incentives and subplots abound. While Sunderland are desperate to avenge an 8-0 humiliation at Southampton earlier in the season and Dick Advocaat is determined to keep them in the Premier League, Ronald Koeman remains on a mission to transport Southampton into Europe. Something has to give in this double-Dutch tactical duel but it will be no surprise if years of haphazard recruitment and general decision making continue to take their toll on a north east club who could do with emulating Southampton’s slick, intelligent synchronicity and efficiency behind the scenes. Louise Taylor	1	0.992000937461853,0.9899067580699921
361	Swansea City	Stoke City	2	0	02/05/2015	15	These two teams are locked in mid-table with no Europa League aspirations but securing eighth place would guarantee either of them a highest ever Premier League finish. Garry Monk described the game as probably Swansea’s most important of the season, but Stoke will rely on their top scorer Mame Biram Diouf or perhaps on another strike from the in-form Charlie Adam, who will play with a protective mask after breaking his nose in training. Peter Georgiev	1	-0.9783473014831543,0
362	West Ham United	Burnley	1	0	02/05/2015	15	Sean Dyche must have hoped that his side’s victory over Manchester City in March would kickstart a survival bid but Burnley have not scored and picked up only one point from the five matches since then, and last Saturday’s home defeat by Leicester means they head to east London five points adrift of safety. West Ham, with only one win in their last 13 games, seem ideal opposition. Paul Chronnell	1	0.5247335433959961,-0.9982945322990417
363	Chelsea	Crystal Palace	1	0	03/05/2015	15	Stamford Bridge will thrill in anticipation of Chelsea’s first Premier League title in five years. The hosts will secure the crown with victory and, given their unbeaten home record this season and Crystal Palace’s recent slip in standards with safety assured, the opportunity is there for the taking. “Them winning the league would be deserved because they’ve done extraordinarily well this season,” said Yannick Bolasie, “but we don’t want them to do it against us.” That may be wishful thinking given it is 33 years since Palace last won at Chelsea. Dominic Fifield	1	0.9997621178627014,0.9721130132675171
364	Tottenham Hotspur	Manchester City	0	1	03/05/2015	15	This one has an end-of-season feel to it. City will not win the title but they will finish in the top four while Tottenham will surely not finish in the top four and nor are they are relishing the chase for Europa League qualification. The worry for Manuel Pellegrini is that there is also an end-of-era feel to it. The manager’s job prospects at City are uncertain while his ageing squad looks set for a summer reboot. David Hytner	-1	0,-0.9826436936855316
365	Aston Villa	West Ham United	1	0	09/05/2015	15	Another home game, another win – that will be the minimum requirement for Tim Sherwood’s Villa, who are only two points above the drop zone, despite beating Everton at Villa Park last Saturday. Gabriel Agbonlahor returns from injury but will start on the bench against a West Ham side who have a chance to qualify for Europe via the fair play table. What a test for Reece Burke, the 18-year-old defender, who will be up against an in-form Christian Benteke. Stuart James	1	0.9810952146848043,0.9962419271469116
366	Crystal Palace	Manchester United	1	2	09/05/2015	15	Crystal Palace and Manchester United have both lost their past three matches without scoring a goal, so something has to give. United, who have lost Michael Carrick for the rest of the season, will hope for better. The recent wobble has left their Champions League place under threat from Liverpool and it will not be straightforward against Palace, who beat Manchester City at Selhurst Park last month. Palace’s Wilfried Zaha will be eager to show his former club that they were wrong to sell him. Jacob Steinberg	-1	-0.0030471384525299072,0.9982195496559143
367	Everton	Sunderland	0	2	09/05/2015	15	Sunderland have one home game left and they have not won away from home in 2015 – that might have to change against Everton to ensure safety. With fixtures at the Emirates and Stamford Bridge still to come, this is Sunderland’s least testing trip of the run-in. However, it will still be tough as there is a fierce determination in the Everton squad to finish a disappointing season strongly. Graham Searles	-1	0.9921318888664246,-0.9899531900882721
368	Hull City	Burnley	0	1	09/05/2015	15	This is Hull City’s most significant league game since the final-day draw against Cardiff that got them back into the Premier League two years ago. One more win might be enough to keep them in the division, while defeat would hugely increase the threat of relegation. Burnley, of course, have to win all their remaining three games to have any chance of remaining in the top flight. Graham Searles	-1	0.9996427297592163,-0.989790678024292
