	HomeTeam	AwayTeam	HomeGoals	AwayGoals	Date	Season	Commentary	Result	sentiment
961	Middlesbrough	Burnley	0	0	08/04/2017	17	The good news was that Middlesbrough managed to score a couple of goals at Hull on Wednesday, the bad that they conceded four. Steve Agnew conceded he “didn’t get the balance quite right” so it will be interesting to see whether Boro’s manager reverts to 4-2-3-1 or sticks with 4-4-2. One thing seems certain though; should the home side fail to beat a Burnleyteam still seeking their first away league victory of the season relegation will surely beckon. Louise Taylor	0	-0.9706932604312897,-0.9921870231628418
962	Stoke City	Liverpool	1	2	08/04/2017	17	Results suggest Stoke are in danger of falling back into their bad old ways of earlier in the season, when it took them eight games to record their first Premier League win. They have lost their last three although Mark Hughes has been at pains to suggest this is their most difficult run of the campaign. Relegation is the faintest of concerns but one more victory should banish any such thoughts and set their sights towards the top half once more. At least Liverpool, vulnerable after drawing with Bournemouth and losing Sadio Mané for the rest of the season, are not as daunting a prospect as they might have been. Nick Ames	-1	-0.994808554649353,-0.9943135976791382
963	Tottenham Hotspur	Watford	4	0	08/04/2017	17	There was mind games talk at Mauricio Pochettino’s press conference on Friday. What did he make of Antonio Conte’s suggestion that Chelsea had to win whereas it was more of a bonus for Tottenham? “Not interested,” he shot back. “If Chelsea don’t win the Premier League, it will be tough for them to accept,” he added. But Pochettino was interested only in his side keeping up the pressure, against a Watford team in the midst of an injury crisis. David Hytner	1	-0.918328732252121,-0.3273271918296814
964	West Brom	Southampton	0	1	08/04/2017	17	Albion are keen to match the eighth-place finish of 2013, their best since 1981, and though their Europa League hopes are fast fading they should give Tony Pulis his first top-10 finish. The visitors, one place behind them, have little to play for but remain a yardstick. “Southampton are a fantastic model … they are a top-10 team and they have some brilliant players,” Pulis said. Mark Tallentire	-1	0.9965013265609741,0.999833345413208
965	West Ham United	Swansea City	1	0	08/04/2017	17	If West Ham lose at home on Saturday Swansea will be only two points behind them and the fear of a humiliating relegation a few months after moving to the London Stadium could well force the club to dispense with the services of Slaven Bilic. But Swansea, who have been through a few managers themselves this season, seem to have come to the end of their revival under Paul Clement and have several injuries to contend with. Rich Flower	1	-0.9986042380332947,-0.9992602467536926
966	Everton	Leicester City	4	2	09/04/2017	17	A Champions League quarter-final at Atlético Madrid looms for the champions and rotation poses a dilemma for Craig Shakespeare after having picked a settled side during his flawless start in the job. Leicester’s prospects of a seventh successive victory in all competitions since the departure of Claudio Ranieri have been enhanced by an Everton defence depleted by injury and suspension. Matthew Pennington will replace the suspended Ashley Williams at centre-back with Ronald Koeman claiming: “If we win our next two home games we can challenge for fifth or sixth.” Andy Hunter	1	0.9836516976356506,0.3289400339126587
967	Sunderland	Manchester United	0	3	09/04/2017	17	Bottom placed Sunderland’s expensive February bonding trip to New York was supposed to save their season but in the six games since returning they have failed to score a single goal. David Moyes will aim to put this week’s controversy behind him by somehow masterminding a victory against his former club but, despite apparently prioritising the Europa League, José Mourinho presumably has very different ideas. Afterwards the pair can compare notes on being rude to broadcast interviewers. Louise Taylor	-1	-0.9979392290115356,0.7659165859222412
968	Crystal Palace	Arsenal	3	0	10/04/2017	17	Picture the scene. Gerry Francis drifts over a corner, Pat Jennings punches clear but only as far as Peter Nicholas just outside the box. The Welshman’s volley is scuffed, but Dave Swindlehurst’s flick takes the ball scuttling beyond static defenders and into the net. Terry Venables’ side withstand second-half pressure and the majority of a crowd of 42,699 departs elated. It is 10 November 1979 and Crystal Palace have achieved what remains their only home victory over Arsenal. Arsène Wenger could not have picked a better venue to seek to build on his team’s midweek win. Dominic Fifield	1	0.0023930370807647705,-0.9095363020896912
969	Crystal Palace	Leicester City	2	2	15/04/2017	17	A daunting run-in has actually coaxed the best out of Crystal Palace, with eye-catching victories over Chelsea and Arsenal already achieved this month. The challenge here is to maintain standards against the champions and to climb further from the condemned near the foot of the table. Leicester City will arrive in south London effectively safe and presumably with one eye on Tuesday’s return leg against Atlético Madrid in the Champions League quarter-finals. The hosts will hope they are a team distracted. Dominic Fifield	0	0.0010387301445007324,0.9990963935852051
970	Everton	Burnley	3	1	15/04/2017	17	Sean Dyche is still searching for a first away win of the season to complement Burnley’s homegrown case for Premier League survival and it would constitute a minor shock should it arrive here on Saturday afternoon. Everton have won their past seven home matches while Romelu Lukaku has scored in eight consecutive Goodison games – a feat last achieved by Fred Pickering in 1965. Ross Barkley is available having suffered no serious injury when attacked in a bar last weekend and Ronald Koeman is expecting a cagey affair. “It will hard to create open chances against them,” the Everton manager said. Andy Hunter	1	-0.3122125069300334,0.9954398572444916
971	Southampton	Manchester City	0	3	15/04/2017	17	Claude Puel will be delighted if Manolo Gabbiadini returns – the Italian had scored nine times in his past eight games in all competitions for Napoli and Southampton before suffering a groin injury. It will be interesting to see if Pierre-Emile Hojbjerg, nurtured by Pep Guardiola at Bayern Munich and described by Puel as the “future” of Southampton, keeps his place against the side managed by his former mentor now that the club captain, Steven Davis, is approaching full fitness. Rich Flower	-1	0.9482043186823527,0
972	Stoke City	Hull City	3	1	15/04/2017	17	Jack Butland may make his long-awaited return for Stoke after over a year out with an ankle injury sustained on England duty. The goalkeeper is likely to be on the bench, particularly as Shay Given is a doubt with a minor back complaint. Hull, who have dragged themselves out of the bottom three with a remarkable revival under Marco Silva, have won away from home only once all season but will fancy their chances against a team who have lost their last four games. Rich Flower	1	0.5511149764060974,0.9995126724243164
973	Sunderland	West Ham United	2	2	15/04/2017	17	Sunderland supporters dare not contemplate just how much further adrift of safety their side would be had Slaven Bilic succeeded in taking Jermain Defoe to east London in January. Bilic, who could do with a win here as he endeavours to convince West Ham’s board that he remains the right man to lead them next season, may yet succeed in recruiting the England striker this summer, while Lamine Koné, David Moyes’s key centre-back, is another name on his shopping list. Louise Taylor	0	-0.004563748836517334,-0.9705125689506531
974	Tottenham Hotspur	Bournemouth	4	0	15/04/2017	17	Mauricio Pochettino continues to look no further than the next game and at his own team. He says the prospect of Tottenham finishing above Arsenal is not on his mind and nor is ramping up the pressure on the leaders, Chelsea. Yet victory here would put both notions into sharper focus. Bournemouth could be forgiven a measure of trepidation – they have found a bit of form but Tottenham appear unbeatable at White Hart Lane. David Hytner	1	-0.1356269121170044,-0.0014587640762329102
975	Watford	Swansea City	1	0	15/04/2017	17	To say that Swansea need a win is an understatement. A horror run of one point from five games has put Paul Clement’s side back in the bottom three after an initial revival under their new manager. Watford, with a defence hampered by injury and suspension, lost 4-0 at Tottenham last week and look vulnerable but Swansea were abject at West Ham and need to shed their anxiety if they are to prosper. Rich Flower	1	0.0039885640144348145,-0.12033265829086304
976	Manchester United	Chelsea	2	0	16/04/2017	17	Whatever José Mourinho says publicly he will want to beat his former side, especially given the 4-0 humiliation in October’s reverse fixture. After he called out all five attackers fielded in Thursday’s 1-1 draw at Anderlecht, Sunday’s question is how they will respond against Chelsea. To hear Zlatan Ibrahimovic named in this group was a surprise as without his 28 goals how dismal might United’s season have been? Jamie Jackson	1	-0.9922670722007751,-0.9378372430801392
977	West Brom	Liverpool	0	1	16/04/2017	17	A Champions League place next season is very much in Liverpool’s hands, but after dropping points against Bournemouth and the scare last time out at Stoke nobody at Anfield is counting any chickens. That is probably a good mindset for a visit to The Hawthorns, where Tony Pulis’s side easily duffed up Arsenal last month and will be sure to test the Merseysiders’ defensive resolve. Paul Chronnell	-1	0.9990948438644409,-0.9552122354507446
978	Middlesbrough	Arsenal	1	2	17/04/2017	17	Arsène Wenger may think he has problems at Arsenal but Middlesbrough really are in trouble. The only side in English league football not to have registered a win during 2017, their last top-flight victory (against Swansea) was on 17 December. Wenger meanwhile acknowledges that a top-four finish represents “a massive challenge” for his stumbling team, conceding “we might do it, we might not”. The odds on both he and Boro’s Steve Agnew remaining in charge of these clubs come August appear pretty slender. Louise Taylor	-1	0.4936242252588272,-0.9780022501945496
979	Bournemouth	Middlesbrough	4	0	22/04/2017	17	Twenty years ago a Middlesbrough team containing Emerson, Juninho and Fabrizio Ravanelli somehow managed to get relegated and it appears, barring a miracle, Boro will be marking the anniversary with another top-flight demotion. If that miracle is to occur, it must start with a win on Saturday followed by another against Sunderland in midweek. Anything else will surely leave Steve Agnew’s side with too much to do given their nightmarish run-in. Rich Flower	1	0.9998767375946045,-0.9985602498054504
980	Hull City	Watford	2	0	22/04/2017	17	Marco Silva says his players can handle “big pressure” and a win here would give a huge boost to Hull’s hopes of avoiding relegation and transfer some of that pressure on to their survival rivals. Watford are not mathematically safe on 40 points and have some difficult fixtures to come before the end of the season but a 12-point cushion should be enough to ensure their safety. Rich Flower	1	0.9974631071090698,0.9522058665752411
981	Swansea City	Stoke City	2	0	22/04/2017	17	While Stoke require more consistency if ninth place is to be theirs this season the real pressure is on Swansea, for whom the winter revival under Paul Clement is starting to look very distant after five defeats in six matches. The games are starting to run out. Clement will have earmarked this one as a good bet for three points and a wildly unpredictable Stoke, for whom Jack Butland could make a long-awaited return from injury, could just as easily oblige as hammer another nail in their coffin. Nick Ames	1	0,-0.2053883671760559
982	West Ham United	Everton	0	0	22/04/2017	17	Although they are nine points above the bottom three, West Ham cannot relax yet. Slaven Bilic’s options have been limited by Andy Carroll’s groin injury and suspensions to Sam Byram and Mark Noble, while another concern for the manager must be Romelu Lukaku’s record against his side. The Everton forward has scored in each of his past nine matches against the Hammers. Jacob Steinberg	0	-0.9945399761199951,0.9980454444885254
983	Burnley	Manchester United	0	2	23/04/2017	17	José Mourinho is unlikely to take this one lightly even though the effects of playing 120 minutes against Anderlecht on Thursday and significant injuries to Zlatan Ibrahimovic and Marcos Rojo suggest they may struggle. United’s manager is so short of options the club’s captain and record scorer, Wayne Rooney, overlooked as substitute against the Belgian club, may even be pressed into service. Mark Tallentire	-1	0,-0.23486727476119995
984	Liverpool	Crystal Palace	1	2	23/04/2017	17	Jürgen Klopp felt “pretty alone” when Palace inflicted the first defeat of his Liverpool reign last season and fans headed for the Anfield exits following Scott Dann’s 82nd minute winner. There is no prospect of a repeat, at least in terms of early departures and managerial isolation, with Liverpool in pursuit of Champions League qualification. Joe Gomez could make his first Premier League appearance of the season with Joel Matip, Ragnar Klavan and Lucas Leiva struggling, although Mamadou Sakho’s ineligibility against his parent club represents a greater loss to Palace. Andy Hunter	-1	-0.8619791865348816,-0.9980150461196899
985	Crystal Palace	Burnley	0	2	29/04/2017	17	Burnley’s quest for an elusive first away win of the season will continue without Joey Barton at Selhurst Park and with recent poor form – one victory in 11 games – anchoring their mood. Yet one more win should ease the lingering nerves at both clubs, and the visitors will hope to exploit Crystal Palace’s crippling injury list at centre-back. Much may depend on how Palace recover from their midweek exertions against Tottenham Hotspur. Dominic Fifield	-1	0.33755284547805786,-0.98282790184021
986	Southampton	Hull City	0	0	29/04/2017	17	Hull City need an away win having lost six and drawn one of Marco Silva’s seven league trips and can call on Oumar Niasse, who had his red card rescinded for last week’s sending off, as they battle for safety with Swansea, who are at Manchester United on Sunday. Saints are on 40 points, have lost their last two but have yet to knock off if their efforts in the 4-2 defeat at Chelsea are to be believed. Mark Tallentire	0	0.7601301670074463,0.9850608706474304
987	Stoke City	West Ham United	0	0	29/04/2017	17	Five defeats in the past six games have put Stoke’s chances of finishing in the top 10 for a fourth successive season in serious jeopardy and West Ham United will move above them in the table with a win. This could bode ill for Mark Hughes, especially after the Stoke manager spoke of “raised expectations” among fans. The visitors will miss the physical presence of Andy Carroll in attack and will be hoping their record signing, André Ayew, can fill the void. Rich Flower	0	0.33352214097976685,-0.9993017911911011
988	Sunderland	Bournemouth	0	1	29/04/2017	17	Sunderland will be relegated from the top flight should they lose and 17th-placed Hull City either draw or win against Southampton. David Moyes’s side won at the Vitality Stadium earlier this season and Bournemouth’s away form has been in a slump ever since. Sunderland must be looking at this match as the last possible chance of redemption for the weary fans of Wearside. Jacque Talbot	-1	-0.9978985488414764,-0.012354075908660889
989	West Brom	Leicester City	0	1	29/04/2017	17	Craig Shakespeare returns to the club where he made more than 100 appearances and worked as community officer, academy coach and reserve coach, even caretaker manager for one game, in search of the three points that would end any relegation fears for Leicester City. West Brom have lost their way a little, losing the last three and failing to score in four successive league matches – five would be a club record. Matt Phillips and Hal Robson-Kanu are out while Wes Morgan is a doubt for Leicester. Stuart James	-1	-0.9996156692504883,0.00679740309715271
990	Everton	Chelsea	0	3	30/04/2017	17	A crucial day in the title race begins here where Antonio Conte’s leaders face what appears their toughest remaining league fixture. Everton may be mediocre on the road but they revel in the comforts of home, winning their last eight, with Romelu Lukaku scoring 14 goals in his last nine Goodison appearances. Tottenham will crave a ninth straight win for Ronald Koeman’s team ahead of the north London derby but another wild Conte celebration would be more than justified should Chelsea prevail. Andy Hunter	-1	0.9996792078018188,0.9220045804977417
991	Manchester United	Swansea City	1	1	30/04/2017	17	Manchester United’s exhausting season continues against Swansea City, who they defeated 3-1 in November. Zlatan Ibrahimovic (two) and Paul Pogba scored United’s goals but both are injured now. Given that eight players are unavailable, including the suspended Marouane Fellaini, José Mourinho is down to the bare bones before Thursday’s Europa League semi-final trip to Celta Vigo. Swansea are third-bottom and fighting for their lives so this may be a cagey encounter. Jamie Jackson	0	-0.949549655119578,-0.9932049512863159
992	Middlesbrough	Manchester City	2	2	30/04/2017	17	Middlesbrough may have enjoyed pushing fellow strugglers – and north-east rivals – Sunderland to the brink of relegation with a 1-0 win in midweek but the three points have come too late to make much difference for Steve Agnew’s side. Boro remain six points from safety and after facing Manchester City they still have games against Chelsea and Liverpool. The chances of a miraculous survival look slim. Rich Flower	0	-0.33418192466100055,0
993	Tottenham Hotspur	Arsenal	2	0	30/04/2017	17	Mauricio Pochettino said he had not heard of “St Totteringham’s Day” – the annual bit of gloating from Arsenal fans about their team’s supremacy over Tottenham. But the Spurs manager is surely about to dismantle it. Win the derby and Spurs will finish above their neighbours for the first time in 22 years. Pochettino wants more. His sights are set on “finishing above all 19 clubs”. He clings to the belief his team could yet reel in Chelsea. David Hytner	1	-0.42114296555519104,-0.9586326479911804
994	Bournemouth	Stoke City	2	2	06/05/2017	17	Tenth hosts 12th with manager Eddie Howe still preaching the importance of mathematically ensuring Bournemouth’s Premier League status. They are nine points clear of relegation, with three games remaining but a much bigger prize looms, a top-half finish. In-form Joshua King, who has scored 12 goals in his last 14 appearances, will again look to showcase his talents against a Stoke team who have not won on the road since January. Ben Fisher	0	0.9941458702087402,0.999575674533844
995	Burnley	West Brom	2	2	06/05/2017	17	A first away win of the season at Crystal Palace brought Burnley to the verge of guaranteed survival and in truth it would take quite a turn of events for them to be endangered now. One more point would take them to the vaunted 40 mark and they should fancy their chances of gaining at least that against a West Brom side that, with four consecutive defeats and five games without a goal, has tailed off dramatically. Six places and five points separate the sides but it is not entirely fanciful to imagine Burnley making that ground up over the final few games. Nick Ames	0	-0.16542521119117737,-0.8039025068283081
996	Hull City	Sunderland	0	2	06/05/2017	17	Sunderland may be down but they will also play a big part in who goes with them as they follow this with a visit from Swansea, who would be five points adrift at 5pm if Hull record their seventh win from Marco Silva’s eight home games. David Moyes has intimated he is staying at Sunderland and knows what has to be done to get them back up, which suggests a mass clear-out. Mark Tallentire	-1	0.9981581568717957,0.7763005495071411
997	Leicester City	Watford	3	0	06/05/2017	17	With 40 points apiece on the board, there is little to choose between these two clubs in the league table, yet everything points to a win for the outgoing Premier League champions. With Jamie Vardy scoring freely, Leicester are marching on under Craig Shakespeare and targeting a top-10 finish. Watford have similar ambitions but have lost their past four away matches without scoring and may start to get a little twitchy if they are not mathematically safe after this weekend. Stuart James	1	0.9968085587024689,-0.9992567896842957
998	Manchester City	Crystal Palace	5	0	06/05/2017	17	As the final four games of Pep Guardiola’s first Premier League campaign are embarked upon Manchester City were not supposed to be merely fighting for a Champions League berth. But this is the unwanted scenario and, with Sam Allardyce’s Crystal Palace still not quite safe from relegation, this may prove a tricky contest for the home side, who are without Sergio Agüero. Jamie Jackson	1	0.9819412231445312,-0.9748418927192688
999	Swansea City	Everton	1	0	06/05/2017	17	A huge game for Swansea, who could be five points behind Hull by the time they kick off at 5.30pm. Either way, Everton’s visit seems like must-win territory for Paul Clement’s side, who have regained some confidence by beating Stoke and then drawing at Old Trafford last Sunday. Everton, on the face of it, have little to play for and their away record – winless in their past six matches – is nothing to write home about. Swansea, though, have never beaten Everton at home. Stuart James	1	0.9958838522434235,-0.0005993247032165527
1000	Arsenal	Manchester United	2	0	07/05/2017	17	It is the statistic that needles Arsène Wenger. In 15 competitive matches, the Arsenal managerArsène Wenger is still to defeat José Mourinho. Wenger has talked about being open to a truce with his long-time adversary but what he really wants is a victory over him. If it happened, the top-four picture would look a lot brighter for Arsenal. Anything less and it could be over. Manchester United’s Europa League semi-final with Celta Vigo may colour the selection of their side. David Hytner	1	6.16908073425293e-05,0.9875582158565521
1001	Liverpool	Southampton	0	0	07/05/2017	17	Jürgen Klopp denies Liverpool struggle at Anfield – saying it was just “the moments” that let Bournemouth and Crystal Palace to take points from the last two home games – but they do have a problem with Southampton. This will be the seventh meeting between the sides in the past two seasons. Liverpool have won only once so far, a 6-1 rout in the Capital One Cup, and have not scored in three games against Claude Puel’s team this term. Philippe Coutinho is on course to recover from the dead leg suffered at Watford on Monday, with the home needing to hold their nerve in the race for Champions League qualification. Andy Hunter	0	-0.09447166323661804,0
1002	Chelsea	Middlesbrough	3	0	08/05/2017	17	Middlesbrough tested Chelsea severely at the Riverside stadium late in November but go into this match acutely aware that their Premier League status could be surrendered if they do not conjure an improbable win on Monday. There will be no let up from the league leaders with the finishing line in sight, though Antonio Conte will be wary of the potential absence of David Luiz and N’Golo Kanté after knocks. “There will be two teams desperate for a result on Monday,” said the Italian. “For this reason, we will see a really good game on Monday.” Dominic Fifield	1	0.986522376537323,0.3702312111854553
1003	Bournemouth	Burnley	2	1	13/05/2017	17	Both sides were tipped for relegation but Bournemouth can secure their highest ever finish in the club’s 118-year history with a point against Burnley and Sean Dyche’s side have already guaranteed their best finish since 1975. However, Eddie Howe will surely be looking for three points to aid their bid for a top-half finish and with the prolific Joshua King starting they have a great chance. Graham Searles	1	0.9994281232357025,0
1004	Manchester City	Leicester City	2	1	13/05/2017	17	Manchester City lost December’s reverse fixture 4-2 and six months later the jury remains out on Pep Guardiola as they continue to fight for a Champions League berth. The Catalan believes Leicester will again try and counter-attack but he will also have known that in the pre-Christmas game. It did not allow his men to stymie Leicester then, so the hope will be that Vincent Kompany’s recent return can make a difference as he was missing for that last meeting. Jamie Jackson	1	0.9845072031021118,-0.29127824306488037
1005	Middlesbrough	Southampton	1	2	13/05/2017	17	With Middlesbrough down and Southampton mid-table it all looks slightly meaningless but the two managers, at least, have much to play for. While Claude Puel, puzzlingly “under pressure” on the south coast intends to convince his board to keep him on next season, Steve Agnew, Boro’s interim boss is hoping against hope that, come August, he might still be in charge in the Championship. Was it really only a year ago that Aitor Karanka’s Boro were celebrating promotion here? Louise Taylor	-1	-0.9944681227207184,0
