	HomeTeam	AwayTeam	HomeGoals	AwayGoals	Date	Season	Commentary	Result	sentiment
0	Arsenal	Sunderland	4	1	22/02/2014	14	Gus Poyet says the excitement at Sunderland has been reflected in the best week of training under his charge. The Capital One Cup final against Manchester City looms next weekend – Sunderland's first major final for 22 years – and there is also an FA Cup quarter-final at Brighton or Hull. Yet nothing matters more than Premier League survival and, with his team in the relegation zone, Poyet is desperate for a tonic. Arsenal want a response to the Champions League loss against Bayern Munich. David Hytner	1	-0.9547230005264282,0.3173554340998332
1	Chelsea	Everton	1	0	22/02/2014	14	Before a reunion with Didier Drogba in midweek, José Mourinho must focus on overcoming a spirited Everton side who defeated them at Goodison back in September. John Terry is back after a muscle injury and Gary Cahill is in contention despite a thigh problem. For Everton, Romelu Lukaku is ineligible against his parent club, while Steven Naismith will play some part after a head injury. Conor Davies	1	0.9953464865684509,0.02847188711166382
2	Crystal Palace	Manchester United	0	2	22/02/2014	14	This promises to be an awkward test for Manchester United, who cannot afford another defeat if they are to keep alive their diminishing hopes of finishing in the top four. Crystal Palace have been excellent at Selhurst Park since Tony Pulis's arrival, winning five of their seven home matches under the former Stoke City manager. Although Palace remain two points above the bottom three, they will fancy their chances of giving David Moyes another headache. United have found it difficult at this ground in the past. Jacob Steinberg	-1	0.9969965020815531,-0.9977181553840637
3	Manchester City	Stoke City	1	0	22/02/2014	14	This visit of Stoke City is the last league game for Manchester City until 15 March due to the League Cup final, an FA Cup sixth-round and the international break so Manuel Pellegrini is keen for his side to sign off with a win. Despite the midweek loss to Barcelona in the Champions League, Pellegrini is confident his players will not be affected so Stoke may be in for a torrid time at the Etihad, where only Chelsea have taken any points from the home side. Jamie Jackson	1	0.9937049746513367,0.8850798606872559
4	West Brom	Fulham	1	1	22/02/2014	14	Felix Magath has always been known as a tough taskmaster and his first act after being handed the Fulham job last week was to order the players in for extra training. We will see this afternoon whether that worked but with only one point from the last six games, they need an instant response. West Bromwich, however, have the next worst recent run of form with three points from 18. Alan Smith	0	-0.9992745518684387,-0.003087550401687622
5	West Ham United	Southampton	3	1	22/02/2014	14	West Ham come into this fixture having won their last three games 2-0 but they have struggled in recent meetings with Southampton, having won just one of the last eight. Mauricio Pochettino's team, meanwhile, are unbeaten in six league games and will be looking to win a third consecutive away game for the first time in the top flight – after victories at Fulham and Hull. Alan Smith	1	-0.9819064140319824,0.9976733028888702
6	Liverpool	Swansea City	4	3	23/02/2014	14	Garry Monk's first visit to Anfield as a player ended in a 7-1 defeat with Southampton in January 1999 but, even with Liverpool prolific at home, he will be confident of an improvement on his first outing here as manager. Last weekend's FA Cup defeat to Everton was Swansea's first defeat in four matches under Monk. They have rediscovered their cohesion and energy in recent weeks but will need to be on peak form to withstand a Liverpool team smarting from their cup exit at Arsenal and sensing a title challenge under the former Swansea manager Brendan Rodgers. Andy Hunter	1	0.9520976841449738,-0.9959172606468201
7	Newcastle United	Aston Villa	1	0	23/02/2014	14	"Villa have just returned from a warm weather training break in Portugal. Paul Lambert can only trust it has done them more good than last month's trip to Abu Dhabi did Newcastle. Since returning, Alan Pardew's team have failed to score a goal while conceding 10 in their last three games. With only one win in nine matches and lacking a home victory since Boxing Day, Pardew is under pressure. ""Newcastle's crowd can become edgy,"" said Lambert. ""We've got to try to get their crowd against them."" Louise Taylor"	1	-0.00028856098651885986,0.9326671361923218
8	Norwich City	Tottenham Hotspur	1	0	23/02/2014	14	After a disappointing loss to West Ham United in their last outing, the Norwich manager, Chris Hughton, will be hoping to ease the pressure and he may have midfielder Jonny Howson returning from a back injury to help him. Tim Sherwood will welcome back Emmanuel Adebayor and Hugo Lloris after they were rested against Dnipro on Thursday as Spurs look to maintain their top-four push. Conor Davies	1	0.984499454498291,0.9994156360626221
9	Aston Villa	Norwich City	4	1	02/03/2014	14	Not a lot of love lost between these two clubs. Relations have been strained ever since Paul Lambert left Norwich for Villa in 2012 and time has not been much of a healer. A game full of subplots – Wes Hoolahan wanted to join Villa from Norwich in January while Grant Holt, who scored prolifically during his time at Carrow Road, is likely to be among the Villa substitutes – carries extra significance because both clubs are desperate for points to climb clear of the relegation scrap. Stuart James	1	-0.26853213707606,0
10	Cardiff	Fulham	3	1	08/03/2014	14	It has been another turbulent week at Cardiff City and one would feel with Everton and Liverpool next up, failure to get a result against the only team below them in the table would plunge Ole Gunnar Solskjaer's team into a deeper crisis. Fulham's new manager, Felix Magath, reckons there is more pressure on Cardiff but, winless since January, they need to improve before it's too late. Alan Smith	1	-0.9975514113903046,0.9959090948104858
11	Crystal Palace	Southampton	0	1	08/03/2014	14	This, on paper, would appear to be one of Crystal Palace's more winnable remaining home fixtures this term as they attempt to move six points clear of relegation, though Tony Pulis' side remain saddled with a dreadful record against the division's current top-nine teams. The point earned at home to Everton remains their only reward in 12 games against the teams from Southampton up and, with Marouane Chamakh hamstrung, a lot will depend upon Glenn Murray hitting the ground running. The Saints will be buoyed by the international recognition gained by their players in midweek, though that may yet prove to have disrupted their preparations. Dominic Fifield	-1	0.9759817719459534,0.4011566638946533
12	Norwich City	Stoke City	1	1	08/03/2014	14	These are games Norwich need to get a result from if they are to stay up. Wes Hoolahan made only his sixth start of the season and scored within three minutes against Aston Villa last week so he should get the nod against a Stoke team minus Charlie Adam, who is banned for a stamp on Olivier Giroud. Mark Hughes' team are not safe either and defeat would see them overtaken by Norwich. Alan Smith	0	-0.990809440612793,0.9898226261138916
13	Aston Villa	Chelsea	1	0	15/03/2014	14	One must wonder how much longer José Mourinho will play down Chelsea's chances. On Friday he spoke of how they are ahead of schedule but refuses to acknowledge that with a seven-point lead heading into this weekend, Chelsea are one of the favourites for the title. Win against Villa, who have lost seven of their eight home games to teams in the top 10, and he must publicly recognise their credentials. Alan Smith	1	0.9993070363998413,-0.8493627309799194
14	Fulham	Newcastle United	1	0	15/03/2014	14	Alan Pardew begins his three-match stadium ban here and Felix Magath may soon find himself wishing he were not at Craven Cottage too. The German was plunged into a mess and his three games in charge have yet to produce any evidence that he can tidy it up. Fulham's best hope of getting their first win league win since New Year's Day could lie in the attitude of their opponents, but, after going through an indifferent spell, Newcastle have won their last two matches and seem to have their heads in the right places again. Paul Doyle	1	-0.3334643443425496,0
15	Hull City	Manchester City	0	2	15/03/2014	14	This time last week, Manchester City were in with a chance of an unprecedented quadruple. Now, with the League Cup already safely secured, they have only the Premier League to focus on. It will be intriguing to see how they bounce back following the defeats to Wigan and Barcelona but Hull will look to use the momentum gained from their FA Cup run to move closer to safety. Alan Smith	-1	0.984805166721344,0.9990297555923462
16	Southampton	Norwich City	4	2	15/03/2014	14	Southampton have won one of their last eight home games but will struggle to find a better chance to improve that run against Norwich whose away form – having lost the previous four away from Carrow Road – could yet be very costly. They are four points clear of the bottom three but do have a favourable run with Sunderland, Swansea, West Bromwich and Fulham after this. Alan Smith	1	0.0003428161144256592,0
17	Stoke City	West Ham United	3	1	15/03/2014	14	Stoke are without Jonathan Walters and Charlie Adam through suspension but are in good form, having lost just once – to Manchester City – in their last six. West Ham have lost once in five matches with Sam Allardyce named manager of the month in February. West Ham, who have conceded just one in their last four games on the road, have won and drawn in their last two league visits to the Britannia Stadium. Daniel Clark	1	0.9995743632316589,0.9021324217319489
18	Sunderland	Crystal Palace	0	0	15/03/2014	14	"Gus Poyet has dubbed this quintessential relegation six-pointer as ""bigger"" than Sunderland's Capital One Cup final against Manchester City and the season's ""most important game."" With Tony Pulis prone to packing Palace's defence and aiming to sneak a goal on the break before pulling everyone back behind the ball again, it will not be easy for Sunderland. Often low on creative guile, Poyet's team frequently struggle to score and so much may depend on whether Adam Johnson and Fabio Borini are in inventive and incisive mood. Louise Taylor"	0	0.2991260091463725,0.9832514524459839
19	Swansea City	West Brom	1	2	15/03/2014	14	Pepe Mel has mustered a mere four points since taking over at West Bromwich and will be without six members of his squad including the captain, Chris Brunt, while Nicolas Anelka has parted company with the club. Swansea are in a similar dire run, claiming three points from their last six games, but Garry Monk could welcome back Michu after a three-month injury layoff. Samar Maguire	-1	-0.5500751733779907,-0.9993618130683899
20	Manchester United	Liverpool	0	3	16/03/2014	14	If Liverpool want to establish themselves as perennial title challengers then winning at Old Trafford has to become a regular occurrence. Brendan Rodgers' team have a chance to start a new trend as the last time Manchester United lost at home to their fiercest rivals was the 4-1 humiliation of 2008-09. David Moyes remains resolute in the midst of a trying inaugural season in charge of the champions but with Liverpool 11 points better off a victory could prove pivotal in turning his team's fortunes around. Jamie Jackson	-1	0.9719836711883545,0.012254893779754639
21	Tottenham Hotspur	Arsenal	0	1	16/03/2014	14	"Tottenham have laboured in recent weeks and it feels as though they must win this one to keep their Champions League dream alive. They have a decent record at home to Arsenal of late and when they won the corresponding fixture last season, there was talk of their rivals being in a ""negative spiral"". Arsenal, though, fought their way back from the crisis, which has become a speciality of theirs. Blood and thunder looms. David Hytner"	-1	0.9991042017936707,0.0359976589679718
22	Chelsea	Arsenal	6	0	22/03/2014	14	"Arsène Wenger will take little satisfaction in overseeing his 1,000th match if the derby he has labelled Arsenal's ""game of the season"" is lost. This contest will go some way towards determining these clubs' respective title challenges, with the visitors aware that, if Wenger secures a first victory in 11 attempts over a team managed by José Mourinho, then a follow-up success at home to Swansea on Tuesday will send them top. Mourinho suggested this game was of no greater significance than last weekend's trip to Aston Villa, though that fooled no one. The loss of Willian and Ramires to suspension feels significant. Dominic Fifield"	1	-0.9969460964202881,-8.526444435119629e-05
23	Everton	Swansea City	3	2	22/03/2014	14	​A win would see Everton leapfrog Tottenham into fifth and, despite a lengthy list of absentees, the omens are good. Roberto Martínez's team have not only won their past seven games at Goodison Park, they have also beaten Swansea in five of the last six meetings. For Garry Monk's team, the threat of relegation looms large – they lie five points off the bottom – and points are required. Alan Smith	1	0.9992570877075195,0.006784558296203613
24	Hull City	West Brom	2	0	22/03/2014	14	Pepe Mel finally guided West Brom to victory in his eighth game by coming from behind at Swansea last weekend. But they must now build on that because, with Sunderland holding two games in hand, Mel's team are by no stretch of the imagination safe. Hull, with only one win in their past eight home league games, could still be dragged into the fight for survival, despite sitting 14th. West Brom would leapfrog Steve Bruce's team with a win, outlining how tightly bunched the bottom half of the table is. Alan Smith	1	-0.23473000526428223,0.034276872873306274
25	Newcastle United	Crystal Palace	1	0	22/03/2014	14	"The good news for struggling Palace is that Newcastle are without the injured Loïc Rémy for a seventh Premier League fixture this season. When the France striker, on loan from QPR, has been absent, Alan Pardew's team have lost five league games, drawn one and failed to score a single goal. ""Rémy's not our player but we struggle to score without him,"" acknowledged the one-time Palace midfielder who, because of a stadium ban, will watch the match on television at the training ground. Much may depend on if and when Hatem Ben Arfa is liberated from the home bench. Louise Taylor"	1	0,0.45096777379512787
26	Norwich City	Sunderland	2	0	22/03/2014	14	Another meeting of two sides struggling to keep their heads above water. Chris Hughton's future at Norwich is in a near constant state of doubt and if they are to maintain their Premier League status, they need results against the teams around them in the table. Sunderland, while third bottom, have games in hand due to their cup runs but that could yet prove their downfall as fixtures pile up. Alan Smith	1	-0.9994416832923889,-0.9984178841114044
27	West Ham United	Manchester United	0	2	22/03/2014	14	The picture is looking much brighter for Manchester United now. Wednesday's victory over Olympiakos in the Champions League has lifted the gloom for David Moyes after last Sunday's humiliation at home to Liverpool, although United will have to be at their best at Upton Park, a ground where they have often come unstuck. The doubts will return if United lose to West Ham, who are not quite clear of the relegation battle just yet. West Ham have lost their past two matches but this is unlikely to be easy for the champions. Jacob Steinberg	-1	-0.9683541655540466,0.8416330218315125
28	Aston Villa	Stoke City	1	4	23/03/2014	14	Aston Villa, buoyed by last week's surprise triumph over Chelsea, aim at Villa Park to make it three successive victories for the first time since October 2007. Hope can be taken from Stoke's poor away form – they have not won a league game outside the Potteries since August – and the fact that Charlie Adam and Jonathan Walters are suspended for the visitors and Stephen Ireland is ineligible. Anastasiia Tikhomirova	-1	0.9995319843292236,-0.9954066276550293
29	Tottenham Hotspur	Southampton	3	2	23/03/2014	14	Spurs restored some pride in the second half against Benfica on Thursday but, after the defeat by Arsenal last weekend, their aim of securing a Champions League place lies in tatters. Injuries have not helped Tim Sherwood's case but he will be desperate to end a four-game winless run at home to Southampton, whose England players remain determined to earn World Cup call-ups. Alan Smith	1	-0.9962688684463501,-0.9953435063362122
30	Arsenal	Manchester City	1	1	29/03/2014	14	Arsenal fans are worried, and little wonder. Injuries have hit and the team's confidence is fragile while they encounter a City side fresh from their humbling of Manchester United and who remain as most people's title favourites. Arsène Wenger has them down as the side to beat. Arsenal's manager might have to temper his natural instinct to get on to the front foot – City bite. The visitors still have to go to Liverpool but they see this as a key staging post. David Hytner	0	-0.4919525533914566,0.9951387345790863
31	Crystal Palace	Chelsea	1	0	29/03/2014	14	Victory in this derby may lack the resonance of last weekend's thrashing of Arsenal, but José Mourinho would still consider it critical. With Liverpool and Manchester City breathing down their necks, Chelsea can ill afford to slip up against a team without a win in five matches. Palace have scored only once, from a penalty, in that time, are without the injured Marouame Chamakh and have their eye on games with Cardiff and Aston Villa to come. Dominic Fifield	1	0.9974532723426819,-0.9992407858371735
32	Manchester United	Aston Villa	4	1	29/03/2014	14	David Moyes insists that the majority of Manchester United fans are behind him despite the midweek derby defeat and hiring of a plane by some to fly over Old Trafford to protest. The Scot concedes he needs to win matches so who knows what might occur if United go down to Villa in what would be a seventh home league defeat. That would be a club record in the Premier League era, beating the mark set just on Tuesday evening when City beat Moyes's side 3-0 and Sir Alex Ferguson was abused by some supporters. This is how dire proceedings currently are at the defending champions. Jamie Jackson	1	-0.585678905248642,0
33	Southampton	Newcastle United	4	0	29/03/2014	14	It says a lot about Southampton and Newcastle that there is likely to be more attention on the referee than them. Andre Marriner will be hoping for a quiet afternoon after his blunder during Chelsea's win over Arsenal last week and will be glad that Alan Pardew, whose stadium ban is over, is not allowed on the touchline yet. Newcastle's manager is looking forward to giving his team-talk after three matches away. But both sides are safe in mid-table, so this is likely to be a low-pressure affair. Jacob Steinberg	1	-0.24835854768753052,0.9923230409622192
34	Stoke City	Hull City	1	0	29/03/2014	14	With seven games to go, Stoke remain on track for a 10th-placed finish, their highest in the Premier League. Unsurprisingly, their home form has been the cornerstone of their relative success and with only two defeats at the Britannia all season, it would be quite surprising if Hull, who are similarly positioned in mid-table but could yet be dragged into a relegation fight, leave with a win. Alan Smith	1	0.9995003938674927,0.999309778213501
35	Swansea City	Norwich City	3	0	29/03/2014	14	Coming off the back of last week's 2-0 win against Sunderland, another victory could see Norwich go 10 points clear of the relegation zone. Despite being without a win in their last six league games, Swansea will have been buoyed by the late point they earned at Arsenal on Tuesday. Norwich have never lost to Swansea in the Premier League but their run of five consecutive away defeats makes this one hard to call. Romily Preston-Ellis	1	0.9947538375854492,0.002540290355682373
36	Fulham	Everton	1	3	30/03/2014	14	Fulham have seven matches to secure their Premier League survival and this threatens to be the hardest of the lot. Everton, with Ross Barkley and Romelu Lukaku seemingly revitalised after being rested by Roberto Martínez, appear to be gaining momentum and their pursuit of a Champions League spot means they will show no mercy to Felix Magath's men, who will likely have to produce their best performance of the season to avoid another defeat. Paul Doyle	-1	-0.9940012097358704,0.9946086406707764
37	Liverpool	Tottenham Hotspur	4	0	30/03/2014	14	Momentum is behind Liverpool in the title race, with Brendan Rodgers's team unbeaten in the Premier Lleague in 2014 and taking 32 points from the last 36 available. The tension surrounding Sunderland's visit on Wednesday did not stop a seventh consecutive win and memories of December's 5-0 thrashing of Tottenham, Liverpool's biggest ever win at White Hart Lane, offer assurance. Spurs have taken one point from seven games against the current top four this season, conceding 23 goals, and have won once in their last 19 league visits to Anfield. Andy Hunter	1	0.9995461106300354,0.997717022895813
38	Aston Villa	Fulham	1	2	05/04/2014	14	Fulham have not won at Villa Park in the Premier League but if they are to cling on to any chance of remaining at the top table next season they need that to change against an Aston Villa minus Christian Benteke, who ruptured an achilles tendon in training on Thursday to ruin his World Cup plans. Paul Lambert's team are unpredictable but with safety almost assured, expect them to score despite being without their main marksman against the league's most porous defence. Alan Smith	-1	0.9926827549934387,-0.9993773102760315
39	Chelsea	Stoke City	3	0	05/04/2014	14	Chelsea cannot afford to dwell on either their midweek defeat in Paris, or for that matter their loss at Crystal Palace seven days ago. A team that looked strong for so long are suddenly faltering on all fronts but this match offers José Mourinho's men a chance to at least re-establish themselves in the Premier League. Worryingly for the home side, they face a Stoke side in good form. Sachin Nakrani	1	0.002399742603302002,0.9997184872627258
40	Hull City	Swansea City	1	0	05/04/2014	14	Swansea currently shade Hull on goal difference after beating Norwich last time out but with both hovering seven points above the danger zone, a win for either should be enough to secure safety. Yet with the excitement building in advance of next weekend's FA Cup semi-final with Sheffield United expect Steve Bruce's starting XI to go all out to impress and secure their place at Wembley. Alan Smith	1	0.9994714856147766,0.9929720759391785
41	Manchester City	Southampton	4	1	05/04/2014	14	City remain favourites to win the title but Southampton should provide more of a challenge than the average visitor to the Etihad this season. Still, three points here would put Manuel Pellegrini's team a point behind Liverpool with the top two set to collide next weekend. Playing in the early kick-off also gives City the opportunity to put a little more pressure on Liverpool and Chelsea with a 14th home win in 15 games. Alan Smith	1	0.9983272552490234,0.9620190858840942
42	Newcastle United	Manchester United	0	4	05/04/2014	14	There was a time when this fixture involved two teams challenging for the title but on Saturday it is all about two managers under considerable scrutiny. While Alan Pardew – who admits he is struggling to motivate Newcastle's players – aims to compensate for last week's disappointing defeat at Southampton, David Moyes must balance the desire for points against potential European glory. With injuries depriving Pardew of several key individuals including Loïc Rémy, it will be interesting to see who he rests ahead of the Manchester United's decisive Champions League trip to Bayern Munich. Louise Taylor	-1	-0.8372634053230286,0.9993664622306824
43	Norwich City	West Brom	0	1	05/04/2014	14	Liverpool, Manchester United, Chelsea and Arsenal: Norwich's run-in is unenviable, making this and next week's trip to Fulham hugely important. Six points clear of the drop, a win over an increasingly desperate West Brom would put them in a good position. Norwich's home form is strong, with an unbeaten run stretching back to December, while West Brom's only win under Pepe Mel came on the road. Defeat for Albion will increase their fears. Alan Smith	-1	0.998147189617157,0.05286616086959839
44	Everton	Arsenal	3	0	06/04/2014	14	Everton's fate is in their hands. Victory over Arsenal would move the Blues, who have won their past five league matches, a point behind them with a game in hand and a top-four finish would be within touching distance. Arsenal have faltered in big matches and will need to defend far better than they did in their previous away match, when they were trounced 6-0 by Chelsea. The scars from that defeat are yet to heal and Everton sense this is their time. Jacob Steinberg	1	-0.7582508325576782,0.004137486219406128
45	West Ham United	Liverpool	1	2	06/04/2014	14	Liverpool are yet to show signs of choking in their charge for the title but West Ham have the potential to make life awkward for them. Upton Park has been a graveyard for potential champions in the past and for Liverpool the fear must be that they will come unstuck at the hands of two of their former players, Andy Carroll and Stewart Downing. West Ham's defence, which has kept 13 clean sheets this season, poses another problem - but Brendan Rodgers has Luis Suárez. Jacob Steinberg	-1	-0.8952601552009583,-0.16681131720542908
